[
  {
    "human": true,
    "match_class": "direct",
    "mirage_flags": [],
    "modalities": [
      "metabolomics",
      "exercise"
    ],
    "notes": "Live MW record. Species=Homo sapiens. The Rockefeller University.",
    "provenance": {
      "row_key": "ST004303",
      "source": "data/live/publications.csv"
    },
    "repository_accession": "ST004303",
    "study_id": "ST004303",
    "title": "Exercise intensity modulates the human plasma secretome and interorgan communication"
  },
  {
    "human": true,
    "match_class": "mirage",
    "mirage_flags": [
      "no_variable_dictionary_or_codebook",
      "unclear_biospecimen_timing"
    ],
    "modalities": [
      "metabolomics",
      "exercise",
      "diet"
    ],
    "notes": "Live MW record. Species=Homo sapiens. University CEU San Pablo.",
    "provenance": {
      "row_key": "ST003807",
      "source": "data/live/publications.csv"
    },
    "repository_accession": "ST003807",
    "study_id": "ST003807",
    "title": "A lipidomic exploration of the effects of high-intensity interval exercise in healthy men after metformin intake"
  }
]
