[
  {
    "human": true,
    "match_class": "direct",
    "mirage_flags": [],
    "modalities": [
      "metabolomics",
      "exercise",
      "cpet",
      "body_composition"
    ],
    "notes": "Previously unseen study identifier and cohort-specific variable labels",
    "provenance": {
      "publication_evidence": "source_provided",
      "repository_row_keys": [
        "SYN-UNSEEN-ENDURANCE::Metabolomics Workbench::MWB-SYN-101::row-2"
      ],
      "representative_repository": {
        "accession": "MWB-SYN-101",
        "repository": "Metabolomics Workbench"
      },
      "row_key": "SYN-UNSEEN-ENDURANCE",
      "source": "bundle:SYN-UNSEEN-COHORT-BUNDLE-V1/publications.csv"
    },
    "repository_accession": "MWB-SYN-101",
    "repository_accessions": [
      "MWB-SYN-101"
    ],
    "study_id": "SYN-UNSEEN-ENDURANCE",
    "title": "Synthetic interval-training metabolomics holdout"
  },
  {
    "human": true,
    "match_class": "direct",
    "mirage_flags": [],
    "modalities": [
      "metabolomics",
      "actigraphy",
      "body_composition",
      "diet"
    ],
    "notes": "Independent synthetic cohort with actigraphy and dietary metadata",
    "provenance": {
      "publication_evidence": "source_provided",
      "repository_row_keys": [
        "SYN-UNSEEN-ACTIVITY::Metabolomics Workbench::MWB-SYN-102::row-3"
      ],
      "representative_repository": {
        "accession": "MWB-SYN-102",
        "repository": "Metabolomics Workbench"
      },
      "row_key": "SYN-UNSEEN-ACTIVITY",
      "source": "bundle:SYN-UNSEEN-COHORT-BUNDLE-V1/publications.csv"
    },
    "repository_accession": "MWB-SYN-102",
    "repository_accessions": [
      "MWB-SYN-102"
    ],
    "study_id": "SYN-UNSEEN-ACTIVITY",
    "title": "Synthetic free-living activity metabolomics holdout"
  }
]
